{
  "schema": 1,
  "policy": "README.md",
  "source": "mendeleev-oxidation-states-2024",
  "elements": [
    {
      "atomic_number": 1,
      "symbol": "H",
      "mendeleev_main": [
        -1,
        1
      ],
      "mendeleev_additional": [],
      "wikipedia_main": [
        -1,
        1
      ],
      "wikipedia_additional": [],
      "print": [
        -1,
        1
      ],
      "principal": [],
      "evidence": {
        "-1": {
          "representative": "NaH",
          "reason": "Saline hydrides are the standard exception to hydrogen's usual positive state.",
          "source": "housecroft-sharpe-2018"
        },
        "1": {
          "representative": "H₂O",
          "reason": "The dominant state of hydrogen in compounds with nonmetals.",
          "source": "housecroft-sharpe-2018"
        }
      },
      "status": "reviewed",
      "reviewer": "Periodisk contributors",
      "reviewed_date": "2026-08-12",
      "notes": "Retain −1 and +1: both metal hydrides and compounds with nonmetals are essential general chemistry."
    },
    {
      "atomic_number": 2,
      "symbol": "He",
      "mendeleev_main": [],
      "mendeleev_additional": [],
      "wikipedia_main": [],
      "wikipedia_additional": [],
      "print": [],
      "principal": [],
      "evidence": {},
      "status": "reviewed",
      "reviewer": "Periodisk contributors",
      "reviewed_date": "2026-08-12",
      "notes": "Print no oxidation states for the compact general-chemistry table; ordinary helium chemistry provides no state meeting the inclusion policy (housecroft-sharpe-2018)."
    },
    {
      "atomic_number": 3,
      "symbol": "Li",
      "mendeleev_main": [
        1
      ],
      "mendeleev_additional": [],
      "wikipedia_main": [
        1
      ],
      "wikipedia_additional": [
        -1
      ],
      "print": [
        1
      ],
      "principal": [],
      "evidence": {
        "1": {
          "representative": "LiCl",
          "reason": "The standard and overwhelmingly characteristic state of lithium compounds.",
          "source": "housecroft-sharpe-2018"
        }
      },
      "status": "reviewed",
      "reviewer": "Periodisk contributors",
      "reviewed_date": "2026-08-12",
      "notes": "Keep only the standard group-1 state +1; exceptional negative states are omitted."
    },
    {
      "atomic_number": 4,
      "symbol": "Be",
      "mendeleev_main": [
        2
      ],
      "mendeleev_additional": [
        1
      ],
      "wikipedia_main": [
        2
      ],
      "wikipedia_additional": [
        -2,
        0,
        1
      ],
      "print": [
        2
      ],
      "principal": [],
      "evidence": {
        "2": {
          "representative": "BeCl₂",
          "reason": "The standard oxidation state throughout ordinary beryllium chemistry.",
          "source": "housecroft-sharpe-2018"
        }
      },
      "status": "reviewed",
      "reviewer": "Periodisk contributors",
      "reviewed_date": "2026-08-12",
      "notes": "Keep only the standard group-2 state +2; uncommon alternatives are omitted."
    },
    {
      "atomic_number": 5,
      "symbol": "B",
      "mendeleev_main": [
        3
      ],
      "mendeleev_additional": [
        -5,
        -1,
        1,
        2
      ],
      "wikipedia_main": [
        3
      ],
      "wikipedia_additional": [
        -5,
        -1,
        0,
        1,
        2
      ],
      "print": [
        3
      ],
      "principal": [],
      "evidence": {
        "3": {
          "representative": "BCl₃",
          "reason": "The characteristic oxidation state of boron in introductory inorganic chemistry.",
          "source": "housecroft-sharpe-2018"
        }
      },
      "status": "reviewed",
      "reviewer": "Periodisk contributors",
      "reviewed_date": "2026-08-12",
      "notes": "Keep only +3 as the compact general-chemistry selection."
    },
    {
      "atomic_number": 6,
      "symbol": "C",
      "mendeleev_main": [
        -4,
        4
      ],
      "mendeleev_additional": [
        -3,
        -2,
        -1,
        1,
        2,
        3
      ],
      "wikipedia_main": [
        -4,
        -3,
        -2,
        -1,
        0,
        1,
        2,
        3,
        4
      ],
      "wikipedia_additional": [],
      "print": [
        -4,
        -3,
        -2,
        -1,
        0,
        1,
        2,
        3,
        4
      ],
      "principal": [],
      "evidence": {
        "-4": {"representative": "CH₄", "reason": "Lowest carbon state and a foundational molecular example.", "source": "housecroft-sharpe-2018"},
        "-3": {"representative": "C₂H₆", "reason": "Each equivalent carbon in ethane has oxidation state −3.", "source": "iupac-oxidation-state-2016"},
        "-2": {"representative": "C₂H₄", "reason": "Each equivalent carbon in ethene has oxidation state −2.", "source": "iupac-oxidation-state-2016"},
        "-1": {"representative": "C₂H₂", "reason": "Each equivalent carbon in ethyne has oxidation state −1.", "source": "iupac-oxidation-state-2016"},
        "0": {"representative": "CH₂O", "reason": "Carbon in methanal demonstrates oxidation state zero in a compound.", "source": "iupac-oxidation-state-2016"},
        "1": {"representative": "CH₃CHO", "reason": "The carbonyl carbon in ethanal has oxidation state +1.", "source": "iupac-oxidation-state-2016"},
        "2": {"representative": "CO", "reason": "Carbon monoxide is a foundational example of carbon(+2).", "source": "housecroft-sharpe-2018"},
        "3": {"representative": "H₂C₂O₄", "reason": "Each equivalent carbon in oxalic acid has oxidation state +3.", "source": "iupac-oxidation-state-2016"},
        "4": {"representative": "CO₂", "reason": "Highest carbon state and a foundational oxide example.", "source": "housecroft-sharpe-2018"}
      },
      "status": "reviewed",
      "reviewer": "Periodisk contributors",
      "reviewed_date": "2026-08-12",
      "notes": "Display as −4…+4; explicit carbon range exception under the selection policy. The representatives demonstrate every integer in the range."
    },
    {
      "atomic_number": 7,
      "symbol": "N",
      "mendeleev_main": [
        -3,
        3,
        5
      ],
      "mendeleev_additional": [
        -2,
        -1,
        1,
        2,
        4
      ],
      "wikipedia_main": [
        -3,
        3,
        5
      ],
      "wikipedia_additional": [
        -2,
        -1,
        0,
        1,
        2,
        4
      ],
      "print": [
        -3,
        1,
        2,
        3,
        4,
        5
      ],
      "principal": [],
      "evidence": {
        "-3": {"representative": "NH₃", "reason": "Ammonia and nitrides make −3 essential in general chemistry.", "source": "housecroft-sharpe-2018"},
        "1": {"representative": "N₂O₂²⁻", "reason": "Symmetric hyponitrite provides an unambiguous nitrogen(+1) representative.", "source": "greenwood-earnshaw-1997"},
        "2": {"representative": "NO", "reason": "Nitric oxide is a familiar and important nitrogen(+2) compound.", "source": "housecroft-sharpe-2018"},
        "3": {"representative": "NO₂⁻", "reason": "Nitrite is a standard general-chemistry nitrogen(+3) ion.", "source": "housecroft-sharpe-2018"},
        "4": {"representative": "NO₂", "reason": "Nitrogen dioxide is a familiar nitrogen(+4) oxide.", "source": "housecroft-sharpe-2018"},
        "5": {"representative": "NO₃⁻", "reason": "Nitrate is a standard and widely encountered nitrogen(+5) ion.", "source": "housecroft-sharpe-2018"}
      },
      "status": "reviewed",
      "reviewer": "Periodisk contributors",
      "reviewed_date": "2026-08-12",
      "notes": "Six-state teaching selection: −3, +1, +2, +3, +4 and +5."
    },
    {
      "atomic_number": 8,
      "symbol": "O",
      "mendeleev_main": [
        -2
      ],
      "mendeleev_additional": [
        -1,
        1,
        2
      ],
      "wikipedia_main": [
        -2
      ],
      "wikipedia_additional": [
        -1,
        0,
        1,
        2
      ],
      "print": [
        -2
      ],
      "principal": [],
      "evidence": {
        "-2": {"representative": "H₂O", "reason": "The overwhelmingly characteristic oxygen state and the standard introductory rule.", "source": "housecroft-sharpe-2018"}
      },
      "status": "reviewed",
      "reviewer": "Periodisk contributors",
      "reviewed_date": "2026-08-12",
      "notes": "Keep only −2 for a simple general-chemistry table. Peroxide and oxygen-fluoride exceptions are deliberately omitted."
    },
    {
      "atomic_number": 9,
      "symbol": "F",
      "mendeleev_main": [
        -1
      ],
      "mendeleev_additional": [],
      "wikipedia_main": [
        -1
      ],
      "wikipedia_additional": [
        0
      ],
      "print": [
        -1
      ],
      "principal": [],
      "evidence": {
        "-1": {"representative": "HF", "reason": "Fluorine takes −1 in compounds under the electronegativity-based definition.", "source": "iupac-oxidation-state-2016"}
      },
      "status": "reviewed",
      "reviewer": "Periodisk contributors",
      "reviewed_date": "2026-08-12",
      "notes": "Keep −1 as fluorine's sole nonzero oxidation state in compounds."
    },
    {
      "atomic_number": 10,
      "symbol": "Ne",
      "mendeleev_main": [],
      "mendeleev_additional": [],
      "wikipedia_main": [],
      "wikipedia_additional": [
        0
      ],
      "print": [],
      "principal": [],
      "evidence": {},
      "status": "reviewed",
      "reviewer": "Periodisk contributors",
      "reviewed_date": "2026-08-12",
      "notes": "Print no oxidation states for the compact general-chemistry table; ordinary neon chemistry provides no state meeting the inclusion policy (housecroft-sharpe-2018)."
    },
    {
      "atomic_number": 11,
      "symbol": "Na",
      "mendeleev_main": [
        1
      ],
      "mendeleev_additional": [
        -1
      ],